{
 "$schema": "https://json-schema.org/draft/2020-12/schema",
 "$id": "vocab.json",
 "title": "Closed vocabularies",
 "description": "Closed vocabularies of the data pipeline (docs/DATA-PIPELINE.md). Each entry of $defs is a JSON Schema (enum, or anyOf of an enum and patterns) referenced as vocab.json#/$defs/<name>; x-terms carries one record per term (x-* keys are ignored by JSON Schema validators). First filled 22 Oct 2026 from /work/.wt-px/raw-data.csv (42,298 rows), data/catalog/unit_aliases.json and model/lqm.py.",
 "$defs": {
  "fact_type": {
   "description": "Fact types (DATA-PIPELINE §2). x-terms: description and the measure slots a fact of this type may fill.",
   "enum": [
    "score",
    "run-score",
    "metric-definition",
    "headline-metric",
    "cost",
    "currency",
    "unit",
    "cost-basis",
    "cost-method",
    "price-table",
    "price-tier",
    "tokens-in",
    "tokens-out",
    "tokens-cache-read",
    "tokens-cache-write-5m",
    "tokens-cache-write-1h",
    "tokens-reasoning",
    "tokens-total",
    "reasoning-included-in-out",
    "cached-share",
    "requests",
    "tokens-in-per-request",
    "model-name",
    "model-api-id",
    "route",
    "mode",
    "effort-label",
    "effort-setting",
    "thinking-on",
    "thinking-off",
    "no-effort-sent",
    "config-history",
    "thinking-budget",
    "tools-regime",
    "run-date",
    "run-start",
    "run-end",
    "run-date-convention",
    "run-id",
    "version",
    "early-access",
    "harness",
    "judge",
    "aggregation",
    "failure",
    "partial",
    "cap",
    "restated-from",
    "same-runs-as",
    "evaluated-by",
    "component-of",
    "items",
    "attempts",
    "note",
    "legacy-row"
   ],
   "x-terms": {
    "score": {
     "description": "A score the source gives for one entry (a cell, a printed number, a chart point).",
     "slots": [
      "value"
     ]
    },
    "run-score": {
     "description": "The score of one run of a measure whose value is a mean of runs (DATA-PIPELINE §5.2 step 4, mean-of-runs): `term` = its metric, `scale` as a score; a fact carries `run` (the run's id), a table cell's run is its row key.",
     "slots": [
      "runs"
     ]
    },
    "metric-definition": {
     "description": "What a metric measures, as the source defines it (formula, scale, bounds).",
     "slots": [
      "setup"
     ]
    },
    "headline-metric": {
     "description": "The source's designated headline metric (or the metric it ranks by).",
     "slots": [
      "setup"
     ]
    },
    "cost": {
     "description": "A money amount the source gives for one run or entry (spend or estimate).",
     "slots": [
      "value",
      "spend"
     ]
    },
    "currency": {
     "description": "The currency of a cost; `term` = a currency of this vocabulary.",
     "slots": [
      "spend"
     ]
    },
    "unit": {
     "description": "What one cost or usage figure covers (per task, per suite...); `term` = a unit of this vocabulary (usage and spend share it).",
     "slots": [
      "spend",
      "usage"
     ]
    },
    "cost-basis": {
     "description": "How the cost was obtained, in the source's words; `term` = a cost basis of this vocabulary.",
     "slots": [
      "spend"
     ]
    },
    "cost-method": {
     "description": "How the cost was computed, in the source's words; `term` = a cost method of this vocabulary.",
     "slots": [
      "spend"
     ]
    },
    "price-table": {
     "description": "The prices the source applied (per class, with their date when stated).",
     "slots": [
      "spend"
     ]
    },
    "price-tier": {
     "description": "The price tier the cost was computed or billed at (`term`: a price kind other than standard, e.g. flex, batch): re-priced to standard by the tier's proven uniform factor (prices.json).",
     "slots": [
      "spend"
     ]
    },
    "tokens-in": {
     "description": "Input tokens (uncached input when the source separates cache).",
     "slots": [
      "usage"
     ]
    },
    "tokens-out": {
     "description": "Output tokens.",
     "slots": [
      "usage"
     ]
    },
    "tokens-cache-read": {
     "description": "Cache-read input tokens.",
     "slots": [
      "usage"
     ]
    },
    "tokens-cache-write-5m": {
     "description": "Cache-write tokens, 5-minute lifetime.",
     "slots": [
      "usage"
     ]
    },
    "tokens-cache-write-1h": {
     "description": "Cache-write tokens, 1-hour lifetime.",
     "slots": [
      "usage"
     ]
    },
    "tokens-reasoning": {
     "description": "Reasoning (thinking) tokens.",
     "slots": [
      "usage"
     ]
    },
    "tokens-total": {
     "description": "Total tokens with no class split (input plus output in one figure): usable only through a uniform factor, or for ratios within one model (DATA-PIPELINE §2).",
     "slots": [
      "usage"
     ]
    },
    "reasoning-included-in-out": {
     "description": "Whether the output tokens include the reasoning tokens: `term` true or false (vocab boolean), read as such.",
     "slots": [
      "usage"
     ]
    },
    "cached-share": {
     "description": "Share of input served from cache, as the source states it.",
     "slots": [
      "usage"
     ]
    },
    "requests": {
     "description": "Number of requests or calls of the run.",
     "slots": [
      "usage"
     ]
    },
    "tokens-in-per-request": {
     "description": "Input tokens of each request of the run, or the largest of them (per-call size): with `requests`, it decides whether a long-context price tier applies (DATA-PIPELINE §5.3 step 1).",
     "slots": [
      "usage"
     ]
    },
    "model-name": {
     "description": "A model's display name as the source writes it.",
     "slots": [
      "model"
     ]
    },
    "model-api-id": {
     "description": "A model's API id / slug as the source writes it.",
     "slots": [
      "model"
     ]
    },
    "route": {
     "description": "Through what the model was called (maker API, reseller, host, router, self-hosting); `term` = a routes.json id when the route is registered.",
     "slots": [
      "route"
     ]
    },
    "mode": {
     "description": "A request parameter or product mode that selects another key (Pro, Deep Think...).",
     "slots": [
      "model",
      "mode"
     ]
    },
    "effort-label": {
     "description": "A label the source gives to a configuration (\"high\", \"lowest effort setting\", \"標準\").",
     "slots": [
      "effort"
     ]
    },
    "effort-setting": {
     "description": "A setting line read in code or config (the source's own call, a harness or router config), with where it was read.",
     "slots": [
      "effort"
     ]
    },
    "thinking-on": {
     "description": "Thinking enabled with no level (a `-thinking` id, AA \"(Reasoning)\", enable_thinking: true).",
     "slots": [
      "effort"
     ]
    },
    "thinking-off": {
     "description": "Thinking disabled (a spelling of `nothink_spelling`).",
     "slots": [
      "effort"
     ]
    },
    "no-effort-sent": {
     "description": "The source states that no effort / thinking parameter was sent.",
     "slots": [
      "effort"
     ]
    },
    "config-history": {
     "description": "A config file's history over an interval (commits showing the same setting).",
     "slots": [
      "effort"
     ]
    },
    "thinking-budget": {
     "description": "A thinking token budget (exact count as written).",
     "slots": [
      "effort"
     ]
    },
    "tools-regime": {
     "description": "Which tools the model had (with tools, without tools, code execution...).",
     "slots": [
      "setup"
     ]
    },
    "run-date": {
     "description": "The day (or datetime) the run took place; a per-run timestamp counts as one.",
     "slots": [
      "run_date"
     ]
    },
    "run-start": {
     "description": "Start of the run interval.",
     "slots": [
      "run_date"
     ]
    },
    "run-end": {
     "description": "End of the run interval.",
     "slots": [
      "run_date"
     ]
    },
    "run-date-convention": {
     "description": "The source documents that its row or run ids encode the run date (e.g. manual-YYYYMMDD-…): `pattern` = a regex with a named group `date` (YYYYMMDD). Cited in run_date, it gives the measure's row key or run-id a stated run date. Only a documented convention (written, with its quote) counts.",
     "slots": [
      "run_date"
     ]
    },
    "run-id": {
     "description": "The source's id of a run.",
     "slots": [
      "aggregation",
      "other"
     ]
    },
    "version": {
     "description": "Benchmark, protocol or board version (the campaign).",
     "slots": [
      "version"
     ]
    },
    "early-access": {
     "description": "The run used a pre-release / early-access model.",
     "slots": [
      "early_access"
     ]
    },
    "harness": {
     "description": "The agent, CLI or evaluation framework that ran the model.",
     "slots": [
      "harness",
      "setup",
      "route"
     ]
    },
    "judge": {
     "description": "The judge (model or panel) that graded this entry, per row when it varies.",
     "slots": [
      "judge"
     ]
    },
    "aggregation": {
     "description": "Which runs a mean covers (number of runs, epochs, which were excluded).",
     "slots": [
      "aggregation"
     ]
    },
    "failure": {
     "description": "Anomaly: the run did not complete or hit an infrastructure error.",
     "slots": [
      "anomalies"
     ]
    },
    "partial": {
     "description": "Anomaly: items missing / not scored.",
     "slots": [
      "anomalies"
     ]
    },
    "cap": {
     "description": "Anomaly: a declared cap (tokens, turns, dollars), scored.",
     "slots": [
      "anomalies"
     ]
    },
    "restated-from": {
     "description": "The number is copied from another publication (named).",
     "slots": [
      "restated_from"
     ]
    },
    "same-runs-as": {